[
  {
    "comment_id": "c1000000-0000-4000-8000-000000000001",
    "candidate_id": "0000002",
    "author_account_id": "a1000000-0000-4000-8000-00000000000a",
    "author_name": "Somchai Pattanakit",
    "author_role": "hr",
    "comment_type": "hr",
    "comment": "Phone screen done 27 Aug - strong communicator, open to relocating to Bangkok.",
    "commented_at": "2026-08-27T10:30:00Z",
    "created_at": "2026-08-27T10:31:12Z",
    "updated_at": "2026-08-27T10:31:12Z",
    "is_edited": false
  },
  {
    "comment_id": "c1000000-0000-4000-8000-000000000002",
    "candidate_id": "0000002",
    "author_account_id": "a1000000-0000-4000-8000-00000000000a",
    "author_name": "Somchai Pattanakit",
    "author_role": "hr",
    "comment_type": "hr",
    "comment": "Sent the take-home. Due 3 Sep.",
    "commented_at": "2026-08-29T14:05:00Z",
    "created_at": "2026-08-29T14:05:40Z",
    "updated_at": "2026-08-29T14:05:40Z",
    "is_edited": false
  },
  {
    "comment_id": "c1000000-0000-4000-8000-000000000003",
    "candidate_id": "0000004",
    "author_account_id": "a1000000-0000-4000-8000-00000000000a",
    "author_name": "Somchai Pattanakit",
    "author_role": "hr",
    "comment_type": "hr",
    "comment": "No degree - bootcamp (Le Wagon 2021). Portfolio is solid.",
    "commented_at": "2026-08-26T09:00:00Z",
    "created_at": "2026-08-26T09:02:31Z",
    "updated_at": "2026-08-26T11:40:02Z",
    "is_edited": true
  },
  {
    "comment_id": "c1000000-0000-4000-8000-000000000004",
    "candidate_id": "0000006",
    "author_account_id": "a1000000-0000-4000-8000-00000000000a",
    "author_name": "Somchai Pattanakit",
    "author_role": "hr",
    "comment_type": "hr",
    "comment": "Referred by the data team. Fast-track.",
    "commented_at": "2026-08-24T08:15:00Z",
    "created_at": "2026-08-24T08:15:22Z",
    "updated_at": "2026-08-24T08:15:22Z",
    "is_edited": false
  },
  {
    "comment_id": "c1000000-0000-4000-8000-000000000005",
    "candidate_id": "0000006",
    "author_account_id": "a1000000-0000-4000-8000-00000000000b",
    "author_name": "Warunee Intira",
    "author_role": "line_manager",
    "comment_type": "line_manager",
    "comment": "Reviewed portfolio - fraud model work is exactly what we need. Move to interview.",
    "commented_at": "2026-08-25T16:45:00Z",
    "created_at": "2026-08-25T16:46:03Z",
    "updated_at": "2026-08-25T16:46:03Z",
    "is_edited": false
  },
  {
    "comment_id": "c1000000-0000-4000-8000-000000000006",
    "candidate_id": "0000006",
    "author_account_id": "a1000000-0000-4000-8000-00000000000b",
    "author_name": "Warunee Intira",
    "author_role": "line_manager",
    "comment_type": "interview",
    "comment": "System design round: solid on trade-offs, thin on observability. Panel leaning yes.",
    "commented_at": "2026-09-02T13:00:00Z",
    "created_at": "2026-09-02T17:22:10Z",
    "updated_at": "2026-09-02T17:22:10Z",
    "is_edited": false
  },
  {
    "comment_id": "c1000000-0000-4000-8000-000000000007",
    "candidate_id": "0000007",
    "author_account_id": "a1000000-0000-4000-8000-00000000000a",
    "author_name": "Somchai Pattanakit",
    "author_role": "hr",
    "comment_type": "hr",
    "comment": "Applied in the previous round, did not pass the take-home. Re-applying.",
    "commented_at": "2026-08-20T11:10:00Z",
    "created_at": "2026-08-20T11:10:45Z",
    "updated_at": "2026-08-20T11:10:45Z",
    "is_edited": false
  },
  {
    "comment_id": "c1000000-0000-4000-8000-000000000008",
    "candidate_id": "0000007",
    "author_account_id": "a1000000-0000-4000-8000-00000000000b",
    "author_name": "Warunee Intira",
    "author_role": "line_manager",
    "comment_type": "line_manager",
    "comment": "Pass for now - salary expectation vs level is off.",
    "commented_at": "2026-08-21T09:30:00Z",
    "created_at": "2026-08-21T09:31:17Z",
    "updated_at": "2026-08-21T09:31:17Z",
    "is_edited": false
  },
  {
    "comment_id": "c1000000-0000-4000-8000-000000000009",
    "candidate_id": "0000008",
    "author_account_id": "a1000000-0000-4000-8000-00000000000a",
    "author_name": "Somchai Pattanakit",
    "author_role": "hr",
    "comment_type": "hr",
    "comment": "Great culture fit in the screen. Waiting on the panel slot.",
    "commented_at": "2026-08-28T15:20:00Z",
    "created_at": "2026-08-28T15:20:55Z",
    "updated_at": "2026-08-28T15:20:55Z",
    "is_edited": false
  },
  {
    "comment_id": "c1000000-0000-4000-8000-00000000000a",
    "candidate_id": "0000008",
    "author_account_id": "a1000000-0000-4000-8000-00000000000b",
    "author_name": "Warunee Intira",
    "author_role": "line_manager",
    "comment_type": "line_manager",
    "comment": "Portfolio review passed. Schedule the system-design round.",
    "commented_at": "2026-08-30T10:00:00Z",
    "created_at": "2026-08-30T10:01:09Z",
    "updated_at": "2026-08-30T10:01:09Z",
    "is_edited": false
  },
  {
    "comment_id": "c1000000-0000-4000-8000-00000000000b",
    "candidate_id": "0000009",
    "author_account_id": "a1000000-0000-4000-8000-00000000000a",
    "author_name": "Somchai Pattanakit",
    "author_role": "hr",
    "comment_type": "hr",
    "comment": "Offer accepted 5 Aug. Start date 1 Sep.",
    "commented_at": "2026-08-05T12:00:00Z",
    "created_at": "2026-08-05T12:00:31Z",
    "updated_at": "2026-08-05T12:00:31Z",
    "is_edited": false
  },
  {
    "comment_id": "c1000000-0000-4000-8000-00000000000c",
    "candidate_id": "0000009",
    "author_account_id": "a1000000-0000-4000-8000-00000000000b",
    "author_name": "Warunee Intira",
    "author_role": "line_manager",
    "comment_type": "line_manager",
    "comment": "Strong hire. Onboarding scheduled.",
    "commented_at": "2026-08-06T09:15:00Z",
    "created_at": "2026-08-06T09:15:48Z",
    "updated_at": "2026-08-06T09:15:48Z",
    "is_edited": false
  },
  {
    "comment_id": "c1000000-0000-4000-8000-00000000000d",
    "candidate_id": "0000009",
    "author_account_id": "a1000000-0000-4000-8000-00000000000c",
    "author_name": "Seed Admin",
    "author_role": "admin",
    "comment_type": "general",
    "comment": "Background check cleared. Nothing outstanding.",
    "commented_at": "2026-08-12T08:40:00Z",
    "created_at": "2026-08-12T08:40:19Z",
    "updated_at": "2026-08-12T08:40:19Z",
    "is_edited": false
  }
]
